{
  "cohort_run_id": "worker_coding_cohort_2026-03-11T08-57-01-157Z",
  "generated_at": "2026-03-11T08:57:50.338Z",
  "summary": {
    "total_runs": 4,
    "pass_count": 0,
    "fail_count": 4,
    "partial_count": 0
  },
  "results": [
    {
      "cohort_id": "C-FE-01",
      "task_class": "fe_create",
      "beta_template_id": "wc.fe_create.v1",
      "verification_tier_target": "lint + build",
      "verification_tier_achieved": "none",
      "result": "fail",
      "failure_attribution": "verification_failure",
      "workflow_run_id": "1a95feaa-8f49-4375-a265-33f172c56aec",
      "run_id": "04e16188-3acc-403b-84b7-5d54c0d6ab22",
      "task_id": "",
      "focused_step_id": "impl_fe",
      "workflow_status": "failed",
      "step_status": "pending",
      "files_changed_count": 0,
      "artifact_completeness": null,
      "operator_note": "scenario=create a small landing page in an existing app; focused_step=impl_fe; workflow_status=failed"
    },
    {
      "cohort_id": "C-FE-02",
      "task_class": "fe_modify",
      "beta_template_id": "wc.fe_modify.v1",
      "verification_tier_target": "lint + type_check + build",
      "verification_tier_achieved": "none",
      "result": "fail",
      "failure_attribution": "verification_failure",
      "workflow_run_id": "48ed2136-5050-4eb6-ba41-295dc5b7eda4",
      "run_id": "80dd1c1b-f503-47ab-9281-4e621e3cf944",
      "task_id": "",
      "focused_step_id": "impl_fe",
      "workflow_status": "failed",
      "step_status": "pending",
      "files_changed_count": 0,
      "artifact_completeness": null,
      "operator_note": "scenario=modify an existing page and add one component; focused_step=impl_fe; workflow_status=failed"
    },
    {
      "cohort_id": "C-BE-01",
      "task_class": "be_create",
      "beta_template_id": "wc.be_create.v1",
      "verification_tier_target": "lint + unit_test",
      "verification_tier_achieved": "none",
      "result": "fail",
      "failure_attribution": "coding_logic_failure",
      "workflow_run_id": "497073b5-b1a9-487d-93ef-e65ff050e5be",
      "run_id": "be65bfde-6313-4a67-81ad-f201b803229c",
      "task_id": "f139d61c-9e11-4f1d-a9a6-82323160cefe",
      "focused_step_id": "impl_be",
      "workflow_status": "failed",
      "step_status": "failed",
      "files_changed_count": 81,
      "artifact_completeness": null,
      "operator_note": "scenario=add one API route or handler; focused_step=impl_be; workflow_status=failed"
    },
    {
      "cohort_id": "C-BUG-01",
      "task_class": "bug_fix",
      "beta_template_id": "wc.bug_fix.v1",
      "verification_tier_target": "lint + unit_test + build",
      "verification_tier_achieved": "none",
      "result": "fail",
      "failure_attribution": "verification_failure",
      "workflow_run_id": "4594b60a-1ef2-411d-8da9-241ac8b46516",
      "run_id": "21ce14f8-4d5a-4df0-8db9-bc5d9aadc13f",
      "task_id": "",
      "focused_step_id": "impl_fe",
      "workflow_status": "failed",
      "step_status": "pending",
      "files_changed_count": 0,
      "artifact_completeness": null,
      "operator_note": "scenario=repair one scoped defect with stated regression boundary; focused_step=impl_fe; workflow_status=failed"
    }
  ]
}